fileName,trnscrpt
Lab41-SRI-VOiCES-rm2-babb-sp1272-ch135031-sg0002-mc03-stu-mid-dg090, i have remained a prisoner only because i wished to be one and with this he stepped forward and burst the stout chains as easily as if they had been threads
Lab41-SRI-VOiCES-rm1-tele-sp1259-ch027120-sg0032-mc05-stu-far-dg090, i never saw such a woman i never saw such capacity and taste and application and elegance as you describe united missus hurst and miss bingley both cried out against the injustice of her implied doubt and were both protesting that they knew many women who answered this description
Lab41-SRI-VOiCES-rm1-none-sp2060-ch147963-sg0031-mc03-stu-mid-dg090, at sight of it the crazy boy began to smack his lips when missus shimerda opened the bag and stirred the contents with her hand it gave out a salty earthy smell very pungent even among the other odors of that cave she measured a teacup full tied it up in a bit of sacking
Lab41-SRI-VOiCES-rm2-none-sp2156-ch025563-sg0022-mc07-stu-beh-dg090, the obedient watkins sidled in and stopped with head averted from gladwin who started with surprise at seeing him stepping forward and making sure there could be no mistake gladwin turned to the thief and exclaimed
Lab41-SRI-VOiCES-rm1-musi-sp0652-ch130726-sg0011-mc03-stu-mid-dg090, the restaurants of the present day that approach nearest the old bohemian restaurants of pre fire days of the french class are jack's in sacramento street between montgomery and kearny felix in montgomery street between clay and washington and the poodle dog bergez franks in bush street between kearny and grant avenue
Lab41-SRI-VOiCES-rm1-babb-sp2269-ch165387-sg0004-mc01-stu-clo-dg090, young rustick's character was entirely the reverse of his father's he was of an awkward clumsy make and the heaviness of his disposition and the coarseness of his manners perfectly corresponded with the shape of his body
Lab41-SRI-VOiCES-rm1-tele-sp7868-ch246932-sg0004-mc05-stu-far-dg090, but more air through the bars of its lungs i rose dressed and went out it was a still warm night no moon but plenty of star light the wind blowing as now gentle and sweet and cool
Lab41-SRI-VOiCES-rm1-musi-sp0188-ch135249-sg0020-mc01-stu-clo-dg090, her marriage had been happy wealth had not spoiled her she was still the placid amiable pink cheeked jane of the old quartette sympathising with her old chum's happiness and as keenly interested in all the dainty details of anne's trousseau
Lab41-SRI-VOiCES-rm1-none-sp1383-ch130532-sg0033-mc03-stu-mid-dg090, i take it for granted i take leave to say i take one picture as an illustration i take pleasure in saying i take the liberty of observing
Lab41-SRI-VOiCES-rm1-musi-sp4859-ch022176-sg0005-mc03-stu-mid-dg090, that princess mary was in moscow the death sufferings and last days of prince andrew had often occupied pierre's thoughts and now recurred to him with fresh vividness having heard at dinner that princess mary was in moscow and living in her house
Lab41-SRI-VOiCES-rm1-none-sp6395-ch087997-sg0045-mc07-stu-beh-dg090, but which is so often accompanied with frivolous and superficial qualities was in him certainly attended with the most severe application the most extensive learning the greatest depth of thought and a capacity in every respect the most comprehensive
Lab41-SRI-VOiCES-rm1-tele-sp2149-ch007239-sg0026-mc05-stu-far-dg090, there is laid up for me the crown of righteousness which the lord the righteous judge will give me in that day and not to me only
Lab41-SRI-VOiCES-rm2-musi-sp7247-ch101864-sg0004-mc01-stu-clo-dg090, the farther away they could get from the oil that made the machinery of life run easily and noiselessly the better pleased they were the dining room looked particularly pleasant this july evening a gentle breeze stirred the curtains at the open windows
Lab41-SRI-VOiCES-rm1-babb-sp7868-ch110705-sg0027-mc03-stu-mid-dg090, for five minutes without stopping apparently with the view of ascertaining if he were quite correctly put together while gluck stood contemplating him in speechless amazement he was dressed in a stashed doublet of spun gold so fine in its texture
Lab41-SRI-VOiCES-rm2-musi-sp4848-ch028247-sg0038-mc01-stu-clo-dg090, the mineral kingdom reigned supreme captain servadac's deep dejection was in strange contrast to his general hilarity silent and tearful he stood upon an ice bound rock
Lab41-SRI-VOiCES-rm2-tele-sp0150-ch126107-sg0026-mc07-stu-beh-dg090, said the princess beyond everything answered he for i have fallen in with the only perfect creature i ever saw no more of that i am tired of it said the princess perhaps she shared her father's aversion to punning
Lab41-SRI-VOiCES-rm2-tele-sp2911-ch015084-sg0012-mc03-stu-mid-dg090, that providence is clear as the sun at noon meanwhile let those who have prevailed yield due honor to the defeated their virtues shine amidst the rubbish of error like diamonds and gold in the gravel of the torrent
Lab41-SRI-VOiCES-rm2-babb-sp3972-ch005791-sg0005-mc05-stu-far-dg090, which would make me revere its possessor were he the lowliest man in your legions allow me noblest of scots to plead one word in vindication of him to whom my allegiance is pledged had he come hither conducted by war alone what would edward have been worse than any other conqueror
Lab41-SRI-VOiCES-rm2-musi-sp8635-ch295756-sg0019-mc03-stu-mid-dg090, the red men cleared a large space and built a fire in the midst of it round which they all sat one of the men then made a grand speech in which he told them how they were to dance when he had done the one who could dance the best sprang up
Lab41-SRI-VOiCES-rm1-none-sp1472-ch285314-sg0013-mc05-stu-far-dg090, why that settles the question i think money is the keystone to success mister west said louise with dignity we are depending chiefly on the literary merit of our newspaper to win recognition of course of course said he hastily
Lab41-SRI-VOiCES-rm1-babb-sp7867-ch110742-sg0034-mc05-stu-far-dg090, he went a long voyage he is my kinsman if i could see him he could give me some account of missus rugg sir said missus croft i never heard of john foy where did he live just above here in orange tree lane there is no such place in this neighbourhood
Lab41-SRI-VOiCES-rm1-babb-sp0882-ch123268-sg0033-mc05-stu-far-dg090, this dense veil hung across the sun threw a deep shadow over the mountain if that huge revolving pillar sloped down it would involve us in its whirling eddies this phenomenon which is not unfrequent when the wind blows from the glaciers is called in icelandic mistour
Lab41-SRI-VOiCES-rm2-musi-sp7278-ch104730-sg0039-mc01-stu-clo-dg090, i said that in another part of the capitol it had been threatened that if a northern abolitionist should go to north carolina and utter a principle of the declaration of independence' here a loud cry of order order burst forth in which the speaker yelled the loudest
Lab41-SRI-VOiCES-rm1-babb-sp0242-ch122625-sg0009-mc01-stu-clo-dg090, as the very master of that working corps who would restore to rectitude the warped system of things because i think no commentator on his writings has yet found the comparison that suits him the terms which rightly characterise his talent
Lab41-SRI-VOiCES-rm1-none-sp0472-ch129994-sg0004-mc01-stu-clo-dg090, no pride no hauteur and your sister just the same all sweetness and affability elinor wished to talk of something else but lucy still pressed her to own that she had reason for her happiness and elinor was obliged to go on
Lab41-SRI-VOiCES-rm1-none-sp1272-ch135031-sg0000-mc05-stu-far-dg090, because you were sleeping instead of conquering the lovely rose princess has become a fiddle without a bow while poor shaggy sits there a cooing dove
Lab41-SRI-VOiCES-rm1-tele-sp1963-ch147036-sg0017-mc01-stu-clo-dg090, she got up to her feet unsteadily and swayed toward him in a second he was by her side his arms about her she made no resistance but rather he felt a yielding towards him which he had missed before her pale face was upturned to his and he stooped and kissed her
Lab41-SRI-VOiCES-rm1-musi-sp7540-ch101799-sg0005-mc01-stu-clo-dg090, poor soul for i was her only child and being a saint leger took naturally to the sea as a profession that i should do so was indeed so completely a foregone conclusion that i was especially educated for it at greenwich upon leaving which
Lab41-SRI-VOiCES-rm1-babb-sp7881-ch109662-sg0035-mc07-stu-beh-dg090, all the way from south america to connive at the sacrifice please to observe how lightly my guilt rests upon my shoulders only little sister i had too and now she's gone come now take something to ease your conscience
Lab41-SRI-VOiCES-rm1-musi-sp3989-ch182394-sg0019-mc03-stu-mid-dg090, way back into the past chug a rum he began a long long time ago when the world was young there was very little dry land and most of the animals lived in the water yes sir most of the animals lived in the water
Lab41-SRI-VOiCES-rm2-musi-sp2294-ch161714-sg0019-mc01-stu-clo-dg090, this latter was careening over as a dusky group of men lifted aboard to a heap of tumbled silks and stuffs in the stern such a sweet piece of insensible merchandise as no man i at least of all could mistake it was heru herself and the rogues were ladling her on board like so much sandal wood or cotton sheeting
Lab41-SRI-VOiCES-rm1-none-sp8605-ch276939-sg0025-mc07-stu-beh-dg090, and which was attended with a slight fever this confined her several days to her house during which booth officiated as her nurse and never stirred from her in all this time she heard not a word from missus james which gave her some uneasiness
Lab41-SRI-VOiCES-rm2-babb-sp3446-ch144021-sg0018-mc05-stu-far-dg090, mate down with fever ngora ngora sunday march fifteenth nineteen o eight at daybreak found that the boy bagua had died during the night on dysentery he was about fourteen days sick at sunset
Lab41-SRI-VOiCES-rm2-babb-sp0868-ch131295-sg0044-mc07-stu-beh-dg090, kobori enshiu katagiri sekishiu vied with each other in forming new combinations we must remember however that the flower worship of the tea masters formed only a part of their aesthetic ritual and was not a distinct religion by itself
Lab41-SRI-VOiCES-rm1-musi-sp0949-ch134660-sg0010-mc01-stu-clo-dg090, that the influence of the place and the belief of a perpetual miracle should have produced some salutary effects on the morals as well as on the faith of the people yet the most respectable of the ecclesiastical writers have been obliged to confess
Lab41-SRI-VOiCES-rm2-musi-sp2294-ch161707-sg0000-mc07-stu-beh-dg090, the tumult of the struggle into which that vision led me still throbs in my mind the soft lisping voices of the planet i ransacked for its sake and the roar of the destruction which followed me back from the quest drowns all other sounds in my ears i must and will write
Lab41-SRI-VOiCES-rm1-musi-sp3994-ch156757-sg0009-mc03-stu-mid-dg090, declaring that she hated castle and would not be sorry if something should happen to spoil his fine nose so when he came to us from the sick room soured and crestfallen because disease had deeply pitted and seamed that feature which had formerly been his pride she laughingly whispered
Lab41-SRI-VOiCES-rm2-none-sp8222-ch274380-sg0026-mc03-stu-mid-dg090, but though he had usually professed himself apprehensive of a violent death he found all his fears to be dissipated before that superior courage by which he was animated no one said he can be more willing to send me out of life than i am desirous to go
Lab41-SRI-VOiCES-rm1-babb-sp0250-ch142276-sg0020-mc01-stu-clo-dg090, and gave the face an undecided expression but he had the same large soft eyes as his daughter eyes which moved slowly and almost grandly round in their orbits and were well veiled by their transparent white eyelids
Lab41-SRI-VOiCES-rm1-babb-sp3483-ch115968-sg0003-mc07-stu-beh-dg090, and laid out new camp locations scattering them farther to the south and avoiding ground which had been seared by the han beams and the immediate locations of the han wrecks during this period a sharp check was kept upon han messages
Lab41-SRI-VOiCES-rm1-none-sp6147-ch034606-sg0018-mc07-stu-beh-dg090, the gentleman behind him chastised him for this by a prick of his sword which made him spring round another prick in the back warned the fellow that one of noble blood was behind him and so on each one wounding him in his turn when the man closed round by the circle of swords and covered with blood
Lab41-SRI-VOiCES-rm2-babb-sp0208-ch126600-sg0011-mc05-stu-far-dg090, freddie fisher fairly fussed when he came to eat his crust often on the floor he'd throw it hoping mother wouldn't know it goops all hate to eat the crust if you're told to then you must
Lab41-SRI-VOiCES-rm2-musi-sp4438-ch052195-sg0014-mc01-stu-clo-dg090, and whether it had filtered down from above and was all right it wouldn't do any harm to try it he decided by the time they had reached the sidewalk and he swung behind ruth and took up his station on the outside then the other problem presented itself
Lab41-SRI-VOiCES-rm1-babb-sp6319-ch064726-sg0004-mc07-stu-beh-dg090, now fifteen years after the princess was born she was with the king and queen at one of their castles and as she was running about by herself she came to a little chamber at the top of a tower and there sat an honest old woman spinning for she had never heard of the king's edict
Lab41-SRI-VOiCES-rm1-babb-sp8152-ch258974-sg0036-mc03-stu-mid-dg090, a word that expresses all that is most characteristic of our complex industrial society the headings just given may serve however to suggest the leading phases of the subject repetition of the same task trains the muscles forms a mental habit
Lab41-SRI-VOiCES-rm2-tele-sp6965-ch291718-sg0029-mc01-stu-clo-dg090, do you suppose it would do any good to shave the cat all over at this i could not resist the impulse to scream and your mother said i do believe the creature knows whenever we speak about her
Lab41-SRI-VOiCES-rm2-musi-sp1066-ch005330-sg0004-mc07-stu-beh-dg090, in spite of his smock frock and his straw wisped hat and his false whiskers black as erebus she knew him for her brother oh richard where have you come from what brings you here did you know me barbara was his rejoinder
Lab41-SRI-VOiCES-rm1-babb-sp4441-ch076263-sg0017-mc01-stu-clo-dg090, quite true i'm going to lecture there on sunday next on sweden a good subject plenty to say if i should fall asleep on your sofa don't waken me i'm dead beat all right old chap go to sleep a few moments later olle was fast asleep and snoring loudly
Lab41-SRI-VOiCES-rm1-musi-sp6099-ch230928-sg0009-mc05-stu-far-dg090, impetuous as usual after a very short acquaintance my mother insisted as a first step to entertaining his suit that he should leave the sea as he had another profession by which he was quite capable of supporting a wife as well as himself
Lab41-SRI-VOiCES-rm2-none-sp0288-ch130994-sg0008-mc01-stu-clo-dg090, if we are unwilling to impair the force of this applauded provision we shall be obliged to conclude that the united states afford the extraordinary spectacle of a government destitute even of the shadow of constitutional power to enforce the execution of its own laws
Lab41-SRI-VOiCES-rm2-musi-sp0093-ch126208-sg0004-mc07-stu-beh-dg090, its interior was the scene of most of jude's education by private study as soon as the horse had learnt the road and the houses at which he was to pause awhile the boy seated in front would slip the reins over his arm ingeniously fix open
Lab41-SRI-VOiCES-rm2-none-sp7976-ch110523-sg0000-mc01-stu-clo-dg090, he had little enough to break or bite and once when there was a great famine in the land he could hardly procure even his daily bread and as he lay thinking in his bed one night he sighed and said to his wife what will become of us
Lab41-SRI-VOiCES-rm1-musi-sp5386-ch004145-sg0031-mc07-stu-beh-dg090, and must not this conclusion be strengthened when they hear ministers of talent and learning declare that the bible does sanction slaveholding and that it ought not to be made a disciplinable offence in churches and must not all doubt be dissipated when one of the most learned professors in our theological seminaries
Lab41-SRI-VOiCES-rm2-none-sp5401-ch102526-sg0028-mc01-stu-clo-dg090, at last a man of ability worked himself up to the surface this was alexius comnenus nephew of the emperor isaac comnenus whose short reign we related in the opening paragraph of this chapter
Lab41-SRI-VOiCES-rm2-tele-sp2532-ch157475-sg0012-mc03-stu-mid-dg090, raggedy andy tried to wiggle backward up the pipe but his clothes caught upon a little piece of tin which stuck out from the inside of the pipe and there he stayed he could neither go down nor come back up what shall we do uncle clem cried
Lab41-SRI-VOiCES-rm1-none-sp2156-ch025563-sg0022-mc01-stu-clo-dg090, the obedient watkins sidled in and stopped with head averted from gladwin who started with surprise at seeing him stepping forward and making sure there could be no mistake gladwin turned to the thief and exclaimed
Lab41-SRI-VOiCES-rm2-babb-sp3549-ch173591-sg0001-mc05-stu-far-dg090, but a dull exile in a petty fort by a hot and sickly river with hard labor bad fare prospective famine and nothing to break the weary sameness but some passing canoe or floating alligator gathered in knots
Lab41-SRI-VOiCES-rm2-babb-sp2269-ch165387-sg0004-mc07-stu-beh-dg090, young rustick's character was entirely the reverse of his father's he was of an awkward clumsy make and the heaviness of his disposition and the coarseness of his manners perfectly corresponded with the shape of his body
Lab41-SRI-VOiCES-rm2-musi-sp0188-ch135249-sg0020-mc07-stu-beh-dg090, her marriage had been happy wealth had not spoiled her she was still the placid amiable pink cheeked jane of the old quartette sympathising with her old chum's happiness and as keenly interested in all the dainty details of anne's trousseau
Lab41-SRI-VOiCES-rm2-none-sp6395-ch087997-sg0045-mc01-stu-clo-dg090, but which is so often accompanied with frivolous and superficial qualities was in him certainly attended with the most severe application the most extensive learning the greatest depth of thought and a capacity in every respect the most comprehensive
Lab41-SRI-VOiCES-rm1-babb-sp0948-ch132705-sg0009-mc01-stu-clo-dg090, a street sweeper walking in upon the world council of scholars it is not to be believed it is against all the rules and all the laws but we knew how to stop them our brothers we said
Lab41-SRI-VOiCES-rm2-tele-sp3835-ch178029-sg0013-mc01-stu-clo-dg090, go back to the army he said drawing himself up to his full height and addressing michaud with a gracious and majestic gesture and tell our brave men and all my good subjects wherever you go that when i have not a soldier left i shall put myself at the head of my beloved nobility
Lab41-SRI-VOiCES-rm1-tele-sp1867-ch148436-sg0037-mc07-stu-beh-dg090, aw twenty five dollars is enough says pa all right says the tenderfoot here's the money and he counts it out in pa's hand he says what a little beauty it would be a treat to see him work on a polo field pa says
Lab41-SRI-VOiCES-rm1-babb-sp3645-ch186230-sg0018-mc07-stu-beh-dg090, and in her voluable irish way berated her aunt until poor phibbs stood aghast at such temerity and even mister watson who arrived to enquire after his client and friend was filled with amazement he cast a significant look at miss merrick who answered it in her usual emphatic way
Lab41-SRI-VOiCES-rm1-musi-sp5401-ch039508-sg0004-mc05-stu-far-dg090, thus next to a dike bituminous coal may be baked to coke or anthracite and chalk and limestone to crystalline marble sandstone may be converted into quartzite and shale into argillite a compact massive clay rock
Lab41-SRI-VOiCES-rm2-tele-sp1961-ch149739-sg0028-mc03-stu-mid-dg090, why of course exclaimed the angel haven't you come to my party didn't you get my invitation i sent you one by mail asked freckles yes said the angel i had to help with the preparations and i couldn't find time to drive out but i wrote you a letter
Lab41-SRI-VOiCES-rm2-none-sp1392-ch128226-sg0016-mc03-stu-mid-dg090, they now fancied themselves transported these ungrateful ones but to what did they owe the convulsion and rapture of their transport to their body and this earth gentle is zarathustra to the sickly verily
Lab41-SRI-VOiCES-rm1-none-sp8051-ch118101-sg0035-mc05-stu-far-dg090, rather smart black well made and well calculated for a canadian he was prompted to escape purely from the desire to be free he fled from a very insulting man by the name of edward schriner from the neighborhood of sairsville mills
Lab41-SRI-VOiCES-rm1-none-sp0196-ch122150-sg0018-mc01-stu-clo-dg090, had remained as officers of country ships they had now a horror of the home service with its harder conditions severer view of duty and the hazard of stormy oceans they were attuned to the eternal peace of eastern sky and sea
Lab41-SRI-VOiCES-rm2-tele-sp5126-ch036956-sg0011-mc07-stu-beh-dg090, a wink from mister lord must have been intended to convey a great deal because owing to the defect in his eyes it required no little exertion and even then could not be considered as a really first class wink
Lab41-SRI-VOiCES-rm2-none-sp8118-ch114476-sg0027-mc05-stu-far-dg090, here was a full half day for the army of the potomac enough in which to destroy a divided portion of the army of northern virginia but colonel winchester raged again and again in vain there was no attack brigade after brigade in blue came up and sat down before the antietam
Lab41-SRI-VOiCES-rm1-musi-sp1874-ch165701-sg0007-mc01-stu-clo-dg090, but also recited doggerel satire of his own concoction punning and emitting sparks of wit lincoln was hailed as the capper of any good things on the rounds even then his friends saw the germs of the statesman in the lank homely crack voiced hobbledehoy
Lab41-SRI-VOiCES-rm1-none-sp7688-ch112187-sg0032-mc01-stu-clo-dg090, get out that two thousand and lay it on the table obey with velocity says i for otherwise alternatives are impending i am preferably a man of mildness but now and then i find myself in the middle of extremities
Lab41-SRI-VOiCES-rm2-none-sp4116-ch013265-sg0006-mc05-stu-far-dg090, you are always doing some queer thing or other felicia said the older girl as the carriage whirled on past the great residences already brilliantly lighted am i what have i done that is queer now rose asked the other looking up suddenly and turning her head towards her sister
Lab41-SRI-VOiCES-rm1-babb-sp1536-ch138488-sg0025-mc05-stu-far-dg090, two generations of public men have since laboured with imperfect success to repair the error which was then committed nor is it improbable that some of the penalties of that error may continue to afflict a remote posterity the bill by which the oath was settled passed the upper house without amendment
Lab41-SRI-VOiCES-rm2-musi-sp0196-ch122159-sg0020-mc03-stu-mid-dg090, he pronounced with a convulsive effort whose stress as if propagated by the waves of the air made my body stir a little in the chair he fixed me with lowering eyes don't you believe me he cried i swear
Lab41-SRI-VOiCES-rm1-tele-sp2289-ch152257-sg0025-mc03-stu-mid-dg090, trib o'ni an to collect and simplify the principal laws the collection which he made was called the code of justinian it still exists and is the model according to which most of the countries of europe have made their laws
Lab41-SRI-VOiCES-rm1-musi-sp0196-ch122152-sg0014-mc01-stu-clo-dg090, stop the engines instead of making a row about it on deck i heard him say get up run fly he swore also the engineer slid down the starboard ladder and bolted round the skylight to the engine room companion
Lab41-SRI-VOiCES-rm2-babb-sp6319-ch064726-sg0004-mc01-stu-clo-dg090, now fifteen years after the princess was born she was with the king and queen at one of their castles and as she was running about by herself she came to a little chamber at the top of a tower and there sat an honest old woman spinning for she had never heard of the king's edict
Lab41-SRI-VOiCES-rm1-musi-sp4438-ch052195-sg0014-mc07-stu-beh-dg090, and whether it had filtered down from above and was all right it wouldn't do any harm to try it he decided by the time they had reached the sidewalk and he swung behind ruth and took up his station on the outside then the other problem presented itself
Lab41-SRI-VOiCES-rm1-musi-sp0296-ch142727-sg0031-mc03-stu-mid-dg090, these derangements are the basis of emotion its physical basis and to be moved is to perceive them take away from the consciousness this physical reflex and emotion ceases it is no longer anything but an idea
Lab41-SRI-VOiCES-rm2-babb-sp4441-ch076263-sg0017-mc07-stu-beh-dg090, quite true i'm going to lecture there on sunday next on sweden a good subject plenty to say if i should fall asleep on your sofa don't waken me i'm dead beat all right old chap go to sleep a few moments later olle was fast asleep and snoring loudly
Lab41-SRI-VOiCES-rm1-musi-sp1066-ch005330-sg0004-mc01-stu-clo-dg090, in spite of his smock frock and his straw wisped hat and his false whiskers black as erebus she knew him for her brother oh richard where have you come from what brings you here did you know me barbara was his rejoinder
Lab41-SRI-VOiCES-rm2-none-sp7995-ch276908-sg0017-mc05-stu-far-dg090, not of that monster man mister booth i am undone am revenged and have now no more business for life let them take it from me when they will our poor gentleman turned pale with horror at this speech
Lab41-SRI-VOiCES-rm1-tele-sp6965-ch291718-sg0029-mc07-stu-beh-dg090, do you suppose it would do any good to shave the cat all over at this i could not resist the impulse to scream and your mother said i do believe the creature knows whenever we speak about her
