fileName,trnscrpt
Lab41-SRI-VOiCES-rm2-musi-sp6895-ch092806-sg0003-mc01-stu-clo-dg090, supper was cooling on the table its heat went into missus mc caskey at nine mister mc caskey came he carried his coat on his arm and his pipe in his teeth and he apologised for disturbing the boarders on the steps as he selected spots of stone
Lab41-SRI-VOiCES-rm1-tele-sp2074-ch149033-sg0020-mc03-stu-mid-dg090, those who read will see how the rooms in hampton court became the compartments in the crystale palace and how the gaierty hotel grew out of the gaiety theatre with many other agreeable changes the novelist will find the tale a model for his future work
Lab41-SRI-VOiCES-rm2-none-sp5456-ch024741-sg0008-mc07-stu-beh-dg090, corollary the mind is able to regard as present external bodies by which the human body has once been affected even though they be no longer in existence or present
Lab41-SRI-VOiCES-rm2-babb-sp0296-ch129659-sg0033-mc07-stu-beh-dg090, both in a transcendental sense abstraction being made of every difference in that which is given and of the mode in which it is determined logicians formerly termed the universal matter the specific difference of this or that part of the universal form
Lab41-SRI-VOiCES-rm2-tele-sp0510-ch130560-sg0011-mc07-stu-beh-dg090, and they had nothing to give them in the night dharmu's wife said they promised to pay us for merely looking after the work and instead we worked hard and have still got nothing we will not work for them anymore
Lab41-SRI-VOiCES-rm1-babb-sp8152-ch258993-sg0005-mc07-stu-beh-dg090, the demand of different families will be for much the same kinds of goods if there were no rich men the demand for vineyards producing fine wines would be less the very best qualities of goods take on the highest prices when there is a small but very wealthy class of purchasers
Lab41-SRI-VOiCES-rm1-none-sp4590-ch018006-sg0017-mc01-stu-clo-dg090, and which were secured at sundown in a grass hut at one corner of my boma one particularly dark night we were startled by a tremendous commotion in this shed but as this was before the man eaters were killed no one dared stir out to investigate the cause of the disturbance
Lab41-SRI-VOiCES-rm1-babb-sp4057-ch183239-sg0019-mc05-stu-far-dg090, thereafter you lost the last precious five minutes before parade in efforts with knife blade or clothesbrush to remove from your tunic the smears of pink paste which had failed to repose on the buttons and had stuck to the surrounding cloth instead
Lab41-SRI-VOiCES-rm2-musi-sp3521-ch012715-sg0017-mc03-stu-mid-dg090, rice bread boil a pint of rice till soft then mix it with a couple of quarts of rice or wheat flour when cool add half a tea cup of yeast a little salt and milk to render it of the consistency of rye bread when light bake it in small buttered pans
Lab41-SRI-VOiCES-rm2-musi-sp7981-ch112058-sg0014-mc03-stu-mid-dg090, but in the course of their travels it had become painfully apparent that the clergy themselves were in urgent need of some awakening force those of good family led for the most part worldly and frivolous lives while the humbler sort were as ignorant as the peasants among whom they lived
Lab41-SRI-VOiCES-rm1-tele-sp4064-ch077779-sg0032-mc01-stu-clo-dg090, don't ask me laughed the idiot i don't know yet i admire all the candidates personally very much but what are your politics republican or democratic asked the lawyer oh that's different said the idiot
Lab41-SRI-VOiCES-rm1-babb-sp1112-ch128136-sg0019-mc07-stu-beh-dg090, are excessively tedious but when mister rodd leaves the problem of the unconditioned to take care of itself and makes no attempt to solve the mysteries of the ego and the non ego he is very pleasant reading indeed
Lab41-SRI-VOiCES-rm1-musi-sp7517-ch100442-sg0004-mc05-stu-far-dg090, aproned behind the counter look out for the currants in the window as you come in i have an idea for something artistic in the way of patterns there but as you love me do not offer to buy any
Lab41-SRI-VOiCES-rm2-tele-sp3923-ch174992-sg0028-mc03-stu-mid-dg090, we may have traps if we like it lord chiltern certainly only say so and we shall know where we are he looked very angry and poor lady chiltern was covered with dismay the duke can destroy the hunt if he pleases no doubt said the lord but we don't like traps lord chiltern
Lab41-SRI-VOiCES-rm1-none-sp7247-ch077778-sg0034-mc05-stu-far-dg090, to be well shaken before taken will be an effective remedy for a torpid liver and the man or woman who suffers from lassitude will doubtless find in the lively airs of our two step composers an efficient tonic to bring their vitality up to a high standard of activity
Lab41-SRI-VOiCES-rm2-none-sp1383-ch130532-sg0033-mc05-stu-far-dg090, i take it for granted i take leave to say i take one picture as an illustration i take pleasure in saying i take the liberty of observing
Lab41-SRI-VOiCES-rm2-tele-sp7850-ch111771-sg0000-mc01-stu-clo-dg090, through the influence of hon thomas l hamer he was admitted at west point in eighteen thirty nine
Lab41-SRI-VOiCES-rm2-musi-sp4859-ch022176-sg0005-mc05-stu-far-dg090, that princess mary was in moscow the death sufferings and last days of prince andrew had often occupied pierre's thoughts and now recurred to him with fresh vividness having heard at dinner that princess mary was in moscow and living in her house
Lab41-SRI-VOiCES-rm2-tele-sp7868-ch246932-sg0004-mc03-stu-mid-dg090, but more air through the bars of its lungs i rose dressed and went out it was a still warm night no moon but plenty of star light the wind blowing as now gentle and sweet and cool
Lab41-SRI-VOiCES-rm1-none-sp4331-ch057179-sg0024-mc01-stu-clo-dg090, that sir jeffrey had a wife and family she was all smiles and all pleasantness and seemed to want no other happiness than what the present moment gave her nor did she once mention lord rufford's name on the next morning after breakfast her aunt sent for her to come up stairs
Lab41-SRI-VOiCES-rm2-musi-sp0652-ch130726-sg0011-mc05-stu-far-dg090, the restaurants of the present day that approach nearest the old bohemian restaurants of pre fire days of the french class are jack's in sacramento street between montgomery and kearny felix in montgomery street between clay and washington and the poodle dog bergez franks in bush street between kearny and grant avenue
Lab41-SRI-VOiCES-rm2-none-sp2060-ch147963-sg0031-mc05-stu-far-dg090, at sight of it the crazy boy began to smack his lips when missus shimerda opened the bag and stirred the contents with her hand it gave out a salty earthy smell very pungent even among the other odors of that cave she measured a teacup full tied it up in a bit of sacking
Lab41-SRI-VOiCES-rm2-tele-sp1259-ch027120-sg0032-mc03-stu-mid-dg090, i never saw such a woman i never saw such capacity and taste and application and elegance as you describe united missus hurst and miss bingley both cried out against the injustice of her implied doubt and were both protesting that they knew many women who answered this description
Lab41-SRI-VOiCES-rm1-none-sp5456-ch058161-sg0003-mc01-stu-clo-dg090, for love was love and better than money the slyer the theft the sweeter the honey and kissing was clover all the world over wherever cupid might wander so thousands of years have come and gone and still the moon is shining on still hymen's torch is lighted
Lab41-SRI-VOiCES-rm1-musi-sp0949-ch134660-sg0018-mc07-stu-beh-dg090, this minister to whom julian communicated without reserve his most careless levities and his most serious counsels received an extraordinary commission to restore in its pristine beauty the temple of jerusalem
Lab41-SRI-VOiCES-rm1-babb-sp1272-ch135031-sg0002-mc05-stu-far-dg090, i have remained a prisoner only because i wished to be one and with this he stepped forward and burst the stout chains as easily as if they had been threads
Lab41-SRI-VOiCES-rm2-none-sp1536-ch141791-sg0006-mc01-stu-clo-dg090, as soon as londonderry had fallen and it was universally supposed that the fall of londonderry could not be long delayed he might cross the sea with part of his forces and land in scotland where his friends were supposed to be numerous when he was once on british ground and in the midst of british adherents
Lab41-SRI-VOiCES-rm1-musi-sp1160-ch139727-sg0005-mc07-stu-beh-dg090, which would be of more use to them we parted he going to philadelphia and i to boston in returning i met at new york with the votes of the assembly by which it appear'd that notwithstanding his promise to me he and the house were already in high contention
Lab41-SRI-VOiCES-rm1-tele-sp7981-ch112057-sg0022-mc05-stu-far-dg090, whereas in refusing to return to the de gondis he was neglecting an opportunity for doing good on a very much larger scale helped by their money and their influence not only their vast estates but paris itself lay open to him as a field for his labors
Lab41-SRI-VOiCES-rm2-babb-sp4014-ch186179-sg0001-mc01-stu-clo-dg090, it was that same day that the three boys from brighton were for the first time assigned to a regular unit of the signal corps also with a real thrill they learned that they were almost immediately to see war service for american troops were already in the trenches
Lab41-SRI-VOiCES-rm2-none-sp6241-ch061943-sg0008-mc07-stu-beh-dg090, on the eleventh day we sighted cape portland over which towered mount myrdals yokul which the weather being clear we made out very readily
Lab41-SRI-VOiCES-rm1-babb-sp4331-ch057179-sg0024-mc07-stu-beh-dg090, that sir jeffrey had a wife and family she was all smiles and all pleasantness and seemed to want no other happiness than what the present moment gave her nor did she once mention lord rufford's name on the next morning after breakfast her aunt sent for her to come up stairs
Lab41-SRI-VOiCES-rm2-none-sp3549-ch173591-sg0001-mc03-stu-mid-dg090, but a dull exile in a petty fort by a hot and sickly river with hard labor bad fare prospective famine and nothing to break the weary sameness but some passing canoe or floating alligator gathered in knots
Lab41-SRI-VOiCES-rm2-musi-sp5126-ch036956-sg0011-mc07-stu-beh-dg090, a wink from mister lord must have been intended to convey a great deal because owing to the defect in his eyes it required no little exertion and even then could not be considered as a really first class wink
Lab41-SRI-VOiCES-rm2-babb-sp1392-ch128226-sg0016-mc05-stu-far-dg090, they now fancied themselves transported these ungrateful ones but to what did they owe the convulsion and rapture of their transport to their body and this earth gentle is zarathustra to the sickly verily
Lab41-SRI-VOiCES-rm1-babb-sp5456-ch058161-sg0003-mc07-stu-beh-dg090, for love was love and better than money the slyer the theft the sweeter the honey and kissing was clover all the world over wherever cupid might wander so thousands of years have come and gone and still the moon is shining on still hymen's torch is lighted
Lab41-SRI-VOiCES-rm1-tele-sp1874-ch165701-sg0007-mc01-stu-clo-dg090, but also recited doggerel satire of his own concoction punning and emitting sparks of wit lincoln was hailed as the capper of any good things on the rounds even then his friends saw the germs of the statesman in the lank homely crack voiced hobbledehoy
Lab41-SRI-VOiCES-rm2-babb-sp1536-ch141791-sg0006-mc07-stu-beh-dg090, as soon as londonderry had fallen and it was universally supposed that the fall of londonderry could not be long delayed he might cross the sea with part of his forces and land in scotland where his friends were supposed to be numerous when he was once on british ground and in the midst of british adherents
Lab41-SRI-VOiCES-rm2-none-sp4014-ch186179-sg0001-mc07-stu-beh-dg090, it was that same day that the three boys from brighton were for the first time assigned to a regular unit of the signal corps also with a real thrill they learned that they were almost immediately to see war service for american troops were already in the trenches
Lab41-SRI-VOiCES-rm2-babb-sp6241-ch061943-sg0008-mc01-stu-clo-dg090, on the eleventh day we sighted cape portland over which towered mount myrdals yokul which the weather being clear we made out very readily
Lab41-SRI-VOiCES-rm2-tele-sp0196-ch122159-sg0020-mc03-stu-mid-dg090, he pronounced with a convulsive effort whose stress as if propagated by the waves of the air made my body stir a little in the chair he fixed me with lowering eyes don't you believe me he cried i swear
Lab41-SRI-VOiCES-rm1-musi-sp2289-ch152257-sg0025-mc03-stu-mid-dg090, trib o'ni an to collect and simplify the principal laws the collection which he made was called the code of justinian it still exists and is the model according to which most of the countries of europe have made their laws
Lab41-SRI-VOiCES-rm1-tele-sp0196-ch122152-sg0014-mc01-stu-clo-dg090, stop the engines instead of making a row about it on deck i heard him say get up run fly he swore also the engineer slid down the starboard ladder and bolted round the skylight to the engine room companion
Lab41-SRI-VOiCES-rm2-babb-sp8118-ch114476-sg0027-mc03-stu-mid-dg090, here was a full half day for the army of the potomac enough in which to destroy a divided portion of the army of northern virginia but colonel winchester raged again and again in vain there was no attack brigade after brigade in blue came up and sat down before the antietam
Lab41-SRI-VOiCES-rm1-babb-sp8118-ch268287-sg0020-mc07-stu-beh-dg090, will no depth of grief no length of time no visitation from him who is over us all ever bend your adamant and implacable will i heard with some surprise his allusion to the great being whom he was not wont to recognise
Lab41-SRI-VOiCES-rm2-babb-sp5635-ch053458-sg0002-mc01-stu-clo-dg090, yet life had become as tedious to him now as it might be to one who was unable to gratify a single wish finally by chance popopo thought of the earth people who dwell in cities and so he resolved to visit them and see how they lived this would surely be fine amusement
Lab41-SRI-VOiCES-rm2-babb-sp5678-ch043302-sg0036-mc01-stu-clo-dg090, the whole procedure of war was a matter of theory there were no precedents with which to compare it it was as if archers disputed as to the results of cordite only one thing was certain that the east had every modern engine and as regards male population
Lab41-SRI-VOiCES-rm2-babb-sp1246-ch124550-sg0011-mc01-stu-clo-dg090, were the members of the tincomb methodist church a vast red brick tabernacle vida sherwin had given her a letter to an earnest woman with eye glasses plaid silk waist and a belief in bible classes who introduced her to the pastor and the
Lab41-SRI-VOiCES-rm2-tele-sp0188-ch135249-sg0020-mc07-stu-beh-dg090, her marriage had been happy wealth had not spoiled her she was still the placid amiable pink cheeked jane of the old quartette sympathising with her old chum's happiness and as keenly interested in all the dainty details of anne's trousseau
Lab41-SRI-VOiCES-rm1-babb-sp8051-ch118101-sg0035-mc03-stu-mid-dg090, rather smart black well made and well calculated for a canadian he was prompted to escape purely from the desire to be free he fled from a very insulting man by the name of edward schriner from the neighborhood of sairsville mills
Lab41-SRI-VOiCES-rm2-babb-sp5456-ch024741-sg0008-mc01-stu-clo-dg090, corollary the mind is able to regard as present external bodies by which the human body has once been affected even though they be no longer in existence or present
Lab41-SRI-VOiCES-rm2-none-sp0296-ch129659-sg0033-mc01-stu-clo-dg090, both in a transcendental sense abstraction being made of every difference in that which is given and of the mode in which it is determined logicians formerly termed the universal matter the specific difference of this or that part of the universal form
Lab41-SRI-VOiCES-rm1-babb-sp4590-ch018006-sg0017-mc07-stu-beh-dg090, and which were secured at sundown in a grass hut at one corner of my boma one particularly dark night we were startled by a tremendous commotion in this shed but as this was before the man eaters were killed no one dared stir out to investigate the cause of the disturbance
Lab41-SRI-VOiCES-rm1-none-sp1536-ch138488-sg0025-mc03-stu-mid-dg090, two generations of public men have since laboured with imperfect success to repair the error which was then committed nor is it improbable that some of the penalties of that error may continue to afflict a remote posterity the bill by which the oath was settled passed the upper house without amendment
Lab41-SRI-VOiCES-rm2-musi-sp3835-ch178029-sg0013-mc01-stu-clo-dg090, go back to the army he said drawing himself up to his full height and addressing michaud with a gracious and majestic gesture and tell our brave men and all my good subjects wherever you go that when i have not a soldier left i shall put myself at the head of my beloved nobility
Lab41-SRI-VOiCES-rm1-none-sp8152-ch258993-sg0005-mc01-stu-clo-dg090, the demand of different families will be for much the same kinds of goods if there were no rich men the demand for vineyards producing fine wines would be less the very best qualities of goods take on the highest prices when there is a small but very wealthy class of purchasers
Lab41-SRI-VOiCES-rm1-tele-sp5401-ch039508-sg0004-mc05-stu-far-dg090, thus next to a dike bituminous coal may be baked to coke or anthracite and chalk and limestone to crystalline marble sandstone may be converted into quartzite and shale into argillite a compact massive clay rock
Lab41-SRI-VOiCES-rm2-babb-sp4116-ch013265-sg0006-mc03-stu-mid-dg090, you are always doing some queer thing or other felicia said the older girl as the carriage whirled on past the great residences already brilliantly lighted am i what have i done that is queer now rose asked the other looking up suddenly and turning her head towards her sister
Lab41-SRI-VOiCES-rm1-musi-sp1867-ch148436-sg0037-mc07-stu-beh-dg090, aw twenty five dollars is enough says pa all right says the tenderfoot here's the money and he counts it out in pa's hand he says what a little beauty it would be a treat to see him work on a polo field pa says
Lab41-SRI-VOiCES-rm1-none-sp1112-ch128136-sg0019-mc01-stu-clo-dg090, are excessively tedious but when mister rodd leaves the problem of the unconditioned to take care of itself and makes no attempt to solve the mysteries of the ego and the non ego he is very pleasant reading indeed
Lab41-SRI-VOiCES-rm2-musi-sp1961-ch149739-sg0028-mc03-stu-mid-dg090, why of course exclaimed the angel haven't you come to my party didn't you get my invitation i sent you one by mail asked freckles yes said the angel i had to help with the preparations and i couldn't find time to drive out but i wrote you a letter
Lab41-SRI-VOiCES-rm1-none-sp5154-ch026559-sg0003-mc07-stu-beh-dg090, the monkey was playing his guitar
Lab41-SRI-VOiCES-rm1-tele-sp7278-ch104730-sg0039-mc07-stu-beh-dg090, i said that in another part of the capitol it had been threatened that if a northern abolitionist should go to north carolina and utter a principle of the declaration of independence' here a loud cry of order order burst forth in which the speaker yelled the loudest
Lab41-SRI-VOiCES-rm2-babb-sp1536-ch138488-sg0027-mc05-stu-far-dg090, mary being not merely queen consort but also queen regnant was inaugurated in all things like a king was girt with the sword lifted up into the throne and presented with the bible the spurs and the orb of the temporal grandees of the realm and of their wives and daughters
Lab41-SRI-VOiCES-rm2-babb-sp7995-ch276908-sg0017-mc03-stu-mid-dg090, not of that monster man mister booth i am undone am revenged and have now no more business for life let them take it from me when they will our poor gentleman turned pale with horror at this speech
Lab41-SRI-VOiCES-rm2-musi-sp1963-ch147036-sg0017-mc07-stu-beh-dg090, she got up to her feet unsteadily and swayed toward him in a second he was by her side his arms about her she made no resistance but rather he felt a yielding towards him which he had missed before her pale face was upturned to his and he stooped and kissed her
Lab41-SRI-VOiCES-rm2-tele-sp7540-ch101799-sg0005-mc07-stu-beh-dg090, poor soul for i was her only child and being a saint leger took naturally to the sea as a profession that i should do so was indeed so completely a foregone conclusion that i was especially educated for it at greenwich upon leaving which
Lab41-SRI-VOiCES-rm2-none-sp2149-ch008912-sg0023-mc01-stu-clo-dg090, and the child became precious as the apple of my eye to me for she was all i had left to love for her sake entirely i married as second wife a homespun woman who had been kind as a mother to her in due time the question of her education came on and i said
Lab41-SRI-VOiCES-rm2-tele-sp0636-ch128331-sg0015-mc05-stu-far-dg090, with marvellous quickness at a distance the more readily because certain men who had by some wonderful exercise of agility climbed up the external architecture to look in from the windows knew madame defarge well and acted as a telegraph between her and the crowd outside the building
Lab41-SRI-VOiCES-rm2-none-sp7247-ch101864-sg0009-mc03-stu-mid-dg090, come come ned don't be foolish he protested you know very well that your brother's stepdaughter has been my ward for a dozen years yes but that is all i know rejoined the young man quietly i have never seen her and scarcely ever heard of her
Lab41-SRI-VOiCES-rm1-tele-sp7247-ch101864-sg0004-mc07-stu-beh-dg090, the farther away they could get from the oil that made the machinery of life run easily and noiselessly the better pleased they were the dining room looked particularly pleasant this july evening a gentle breeze stirred the curtains at the open windows
Lab41-SRI-VOiCES-rm1-tele-sp4848-ch028247-sg0038-mc07-stu-beh-dg090, the mineral kingdom reigned supreme captain servadac's deep dejection was in strange contrast to his general hilarity silent and tearful he stood upon an ice bound rock
Lab41-SRI-VOiCES-rm1-musi-sp0150-ch126107-sg0026-mc01-stu-clo-dg090, said the princess beyond everything answered he for i have fallen in with the only perfect creature i ever saw no more of that i am tired of it said the princess perhaps she shared her father's aversion to punning
Lab41-SRI-VOiCES-rm1-tele-sp4438-ch052195-sg0014-mc07-stu-beh-dg090, and whether it had filtered down from above and was all right it wouldn't do any harm to try it he decided by the time they had reached the sidewalk and he swung behind ruth and took up his station on the outside then the other problem presented itself
Lab41-SRI-VOiCES-rm1-tele-sp0296-ch142727-sg0031-mc03-stu-mid-dg090, these derangements are the basis of emotion its physical basis and to be moved is to perceive them take away from the consciousness this physical reflex and emotion ceases it is no longer anything but an idea
Lab41-SRI-VOiCES-rm1-musi-sp6965-ch291718-sg0029-mc07-stu-beh-dg090, do you suppose it would do any good to shave the cat all over at this i could not resist the impulse to scream and your mother said i do believe the creature knows whenever we speak about her
Lab41-SRI-VOiCES-rm1-tele-sp1066-ch005330-sg0004-mc01-stu-clo-dg090, in spite of his smock frock and his straw wisped hat and his false whiskers black as erebus she knew him for her brother oh richard where have you come from what brings you here did you know me barbara was his rejoinder
Lab41-SRI-VOiCES-rm1-tele-sp0242-ch122625-sg0004-mc05-stu-far-dg090, conventionality is not morality self righteousness is not religion to attack the first is not to assail the last to pluck the mask from the face of the pharisee is not to lift an impious hand to the crown of thorns
Lab41-SRI-VOiCES-rm1-tele-sp0093-ch126208-sg0004-mc01-stu-clo-dg090, its interior was the scene of most of jude's education by private study as soon as the horse had learnt the road and the houses at which he was to pause awhile the boy seated in front would slip the reins over his arm ingeniously fix open
Lab41-SRI-VOiCES-rm2-tele-sp5386-ch004145-sg0031-mc01-stu-clo-dg090, and must not this conclusion be strengthened when they hear ministers of talent and learning declare that the bible does sanction slaveholding and that it ought not to be made a disciplinable offence in churches and must not all doubt be dissipated when one of the most learned professors in our theological seminaries
Lab41-SRI-VOiCES-rm1-none-sp7498-ch099124-sg0015-mc01-stu-clo-dg090, her eyes were a dark grey her complexion was exquisitely fine and her hands and arms remarkably delicate both as to shape and colour her stature was of an height that rose to the majestic
Lab41-SRI-VOiCES-rm1-babb-sp7981-ch112061-sg0012-mc03-stu-mid-dg090, vincent's reception of these proposals was disconcerting god forbid he would cry indignantly better that we should all go without the barest necessities of life some would come with a recommendation from the queen herself which made things doubly embarrassing
Lab41-SRI-VOiCES-rm1-tele-sp2294-ch161714-sg0019-mc07-stu-beh-dg090, this latter was careening over as a dusky group of men lifted aboard to a heap of tumbled silks and stuffs in the stern such a sweet piece of insensible merchandise as no man i at least of all could mistake it was heru herself and the rogues were ladling her on board like so much sandal wood or cotton sheeting
Lab41-SRI-VOiCES-rm2-babb-sp5157-ch047239-sg0031-mc05-stu-far-dg090, that she could utter nothing but tears of joy and tenderness i went to davison yesterday morning and found him still in bed having had a severe fit of the gout and with your letter which he had just received and he cried like a child
Lab41-SRI-VOiCES-rm1-musi-sp0492-ch131899-sg0001-mc05-stu-far-dg090, blew a gale and retarded the steamer the rangoon rolled heavily and the passengers became impatient of the long monstrous waves which the wind raised before their path
